
mysql> select * from member;
+-----------+---------------+---------------+--------+----------+-------------+--------------+
| member_id | name          | email         | rollno | status   | branch_code | date_of_join |
+-----------+---------------+---------------+--------+----------+-------------+--------------+
|       501 | Karthik Vijay | kv@gmail.com  |     31 | inactive |        7603 | 2022-06-01   |
|       502 | Adarsh J      | adj@yahoo.com |     32 | active   |        7600 | 2022-06-02   |
+-----------+---------------+---------------+--------+----------+-------------+--------------+
2 rows in set (0.00 sec)


mysql> create table history(member_id integer,name varchar(20), email varchar(20),rollno int, status varchar(10), branch_code varchar(20), date_of_join date);

mysql> create trigger update_History
    ->     before update on member
    ->     for each row
    ->     begin
    ->         insert into history values(old.member_id, old.name,  old.email,old.rollno,  old.status, old.branch_code, old.date_of_join);
    ->     end //
Query OK, 0 rows affected (0.01 sec)

mysql> update member set status = "Inactive" where member_id=502;
    -> //
Query OK, 1 row affected (0.01 sec)
Rows matched: 1  Changed: 1  Warnings: 0

mysql> select * from member;//
+-----------+---------------+---------------+--------+----------+-------------+--------------+
| member_id | name          | email         | rollno | status   | branch_code | date_of_join |
+-----------+---------------+---------------+--------+----------+-------------+--------------+
|       501 | Karthik Vijay | kv@gmail.com  |     31 | inactive |        7603 | 2022-06-01   |
|       502 | Adarsh J      | adj@yahoo.com |     32 | Inactive |        7600 | 2022-06-02   |
+-----------+---------------+---------------+--------+----------+-------------+--------------+
2 rows in set (0.00 sec)

mysql> select * from history;
    -> //
+-----------+----------+---------------+--------+--------+-------------+--------------+
| member_id | name     | email         | rollno | status | branch_code | date_of_join |
+-----------+----------+---------------+--------+--------+-------------+--------------+
|       502 | Adarsh J | adj@yahoo.com |     32 | active | 7600        | 2022-06-02   |
+-----------+----------+---------------+--------+--------+-------------+--------------+
2 rows in set (0.00 sec)
